"mistmnt","426","1","categorical","7","module 17: mental illness & stigma","receiving medicine or treatment from health pro for emotional problem","0"
"mistrhlp","427","1","categorical","10","module 17: mental illness & stigma","mental health treatment can help people lead normal life","0"
"miswtles","423","1","categorical","10","module 17: mental illness & stigma","how often feel worthless past 30 days","0"
"mscode","1306","1","categorical","8","questionnaire language","metropolitan status code","0"
"nocov121","339","1","categorical","7","module 4: health care access","without health care coverage past 12 months","0"
"numadult","68","2","numeric","0","record identification","number of adults in household","1"
"numhhol2","170","1","categorical","7","chronic health conditions","household telephones","0"
"nummen","70","2","numeric","0","record identification","number of adult men in household","1"
"numphon2","171","1","categorical","11","chronic health conditions","residential phones","0"
"numwomen","72","2","numeric","0","record identification","number of adult women in household","1"
"orngday_","2235","4","numeric","0","calculated variables","computed orange-colored vegetable intake in times per day","1"
"pa1min_","2328","5","numeric","0","calculated variables","minutes of total physical activity per week","1"
"pa1vigm_","2343","5","numeric","0","calculated variables","minutes of total vigorous physical activity per week","1"
"padur1_","2286","3","numeric","0","calculated variables","minutes of first activity","1"
"padur2_","2289","3","numeric","0","calculated variables","minutes of second activity","1"
"pafreq1_","2292","5","numeric","0","calculated variables","physical activity frequency per week for first activity","1"
"pafreq2_","2297","5","numeric","0","calculated variables","physical activity frequency per week for second activity","1"
"painact2","290","2","integer","","module 3: healthy days (symptoms)","how many days hard to do usual activities in past 30 days","0"
"pamin11_","2318","5","numeric","0","calculated variables","minutes of physical activity per week for first activity","1"
"pamin21_","2323","5","numeric","0","calculated variables","minutes of physical activity per week for second activity","1"
"pamiss1_","2317","1","numeric","0","calculated variables","missing physical activity data","1"
"pavig11_","2333","5","numeric","0","calculated variables","minutes of vigorous physical activity per week for first activity","1"
"pavig21_","2338","5","numeric","0","calculated variables","minutes of vigorousphysical activity per week for second activity","1"
"pcdmdecn","408","4","numeric","0","module 15: prostate cancer screening decision making module","who made the decision with you to have psa test?","1"
"pcpsaad2","401","1","categorical","7","module 14: prostate cancer screening","has a health professional ever talked with you about the advantages of the psa test?","0"
"pcpsade1","407","1","categorical","8","module 15: prostate cancer screening decision making module","why was psa test done?","0"
"pcpsadi1","402","1","categorical","7","module 14: prostate cancer screening","has a health professional ever talked with you about the disadvantages of the psa test?","0"
"pcpsare1","403","1","categorical","7","module 14: prostate cancer screening","has a doctor ever recommended that you have a psa test?","0"
"pcpsars1","406","1","categorical","10","module 14: prostate cancer screening","what was the main reason you had this psa test?","0"
"pctcell","589","3","numeric","0","cell phone introduction","what percent of your calls are received on your cell phone?","1"
"pdiabtst","270","1","categorical","7","module 1: pre-diabetes","had a test for high blood sugar in past three years","0"
"persdoc2","88","1","categorical","8","health care access","multiple health care professionals","0"
"physhlth","81","2","integer","","healthy days - health-related quality of life","number of days physical health not good","0"
"pneuvac3","254","1","categorical","7","immunization","pneumonia shot ever","0"
"poorhlth","85","2","integer","","healthy days - health-related quality of life","poor physical or mental health","0"
"prediab1","271","1","categorical","8","module 1: pre-diabetes","ever been told you have pre-diabetes or borderline diabetes","0"
"pregnant","179","1","categorical","7","chronic health conditions","pregnancy status","0"
"profexam","391","1","categorical","7","module 12: breast cancer and cervical cancer screening","ever had breast physical exam by doctor","0"
"psatest1","404","1","categorical","7","module 14: prostate cancer screening","ever had psa test","0"
"psatime","405","1","categorical","10","module 14: prostate cancer screening","time since last psa test","0"
"pvtresd1","63","1","categorical","6","record identification","private residence?","0"
"pvtresd2","583","1","categorical","5","cell phone introduction","do you live in a private residence?","0"
"qlactlm2","180","1","categorical","7","chronic health conditions","activity limitation due to health problems","0"
"qlhlth2","296","2","integer","","module 3: healthy days (symptoms)","how many days full of energy in past 30 days","0"
"qlmentl2","292","2","integer","","module 3: healthy days (symptoms)","how many days depressed in past 30 days","0"
"qlstres2","294","2","integer","","module 3: healthy days (symptoms)","how many days felt anxious in past 30 days","0"
"qstlang","594","2","integer","","questionnaire language","language identifier","0"
"qstver","592","2","numeric","0","questionnaire version","questionnaire version identifier","1"
"rcsgendr","494","1","categorical","6","module 19: social context","gender of child","0"
"rcsrltn2","529","1","categorical","11","module 19: social context","relationship to child","0"
"rduchart","378","1","categorical","7","module 8: cardiovascular health","take aspirin to reduce chance of heart attack","0"
"rducstrk","379","1","categorical","7","module 8: cardiovascular health","take aspirin to reduce chance of stroke","0"
"renthom1","177","1","categorical","8","chronic health conditions","own or rent home","0"
"rlivpain","377","1","categorical","7","module 8: cardiovascular health","take aspirin to relieve pain","0"
"rratwrk2","414","1","categorical","10","module 16: reactions to race","how do you feel you were treated at work compared to people of other races in past 12 months?","0"
"rrclass2","412","1","categorical","12","module 16: reactions to race","how do other people usually classify you in this country?","0"
"rrcognt2","413","1","categorical","12","module 16: reactions to race","how often do you think about your race?","0"
"rremtsm2","417","1","categorical","7","module 16: reactions to race","times past 30 days felt emotionally upset because of treatment due to your race","0"
"rrhcare3","415","1","categorical","11","module 16: reactions to race","when seeking health care past 12 months, was experience worse, same, better than people of other races?","0"
"rrphysm2","416","1","categorical","7","module 16: reactions to race","times past 30 days felt physical symptoms because of treatment due to your race","0"
"scntlpad","484","1","categorical","9","module 19: social context","how were you generally paid for the work you did","0"
"scntlwk1","485","2","integer","","module 19: social context","how many hours per week did you work","0"
"scntmeal","480","1","categorical","11","module 19: social context","times past 12 months worried/stressed about having enough money to buy nutritious meals?","0"
"scntmony","479","1","categorical","11","module 19: social context","times past 12 months worried/stressed about having enough money to pay your rent/mortgage?","0"
"scntpaid","481","1","categorical","9","module 19: social context","how are you generally paid for the work you do","0"
"scntvot1","487","1","categorical","8","module 19: social context","did you vote in the last presidential election?","0"
"scntwrk1","482","2","integer","","module 19: social context","how many hours per week do you work","0"
"seatbelt","245","1","categorical","11","seatbelt use","how often use seatbelts in car?","0"
"seqno","35","10","numeric","0","record identification","annual sequence number","1"
"sex","178","1","categorical","5","chronic health conditions","respondents sex","0"
"sleptim1","91","2","integer","","inadequate sleep","how much time do you sleep","0"
"smokday2","188","1","categorical","8","tobacco use","frequency of days now smoking","0"
"smoke100","187","1","categorical","7","tobacco use","smoked at least 100 cigarettes","0"
"ssbfrut2","349","3","integer","","module 5: sugar drinks","how often did you drink sugar-sweetened drinks?","0"
"ssbsugar","346","3","integer","","module 5: sugar drinks","how often do you drink regular soda or pop?","0"
"stateres","65","1","numeric","0","record identification","resident of state","1"
"stopsmk2","189","1","categorical","7","tobacco use","stopped smoking in past 12 months","0"
"strehab1","374","1","categorical","7","module 8: cardiovascular health","outpatient rehab after hosp stay for stroke","0"
"strength","237","3","integer","","exercise (physical activity)","how many times did you do physical activities or exercises to strengthen your muscles?","0"
"strfreq_","2312","5","numeric","0","calculated variables","strength activity frequency per week","1"
"tetanus","253","1","categorical","9","immunization","received tetanus shot since 2005?","0"
"toldhi2","97","1","categorical","7","cholesterol awareness","ever told blood cholesterol high","0"
"useequip","181","1","categorical","7","chronic health conditions","health problems requiring special equipment","0"
"usenow3","192","1","categorical","8","tobacco use","use of smokeless tobacco products","0"
"vegeda1_","2239","4","numeric","0","calculated variables","computed vegetable intake in times per  day","1"
"vegetab1","217","3","integer","","fruits & vegetables","how many times did you eat other vegetables?","0"
"veteran3","146","1","categorical","7","chronic health conditions","are you a veteran","0"
"weight2","154","4","integer","","chronic health conditions","reported weight in pounds","0"
"whrtst10","262","2","categorical","14","hiv/aids","location of last hiv test","0"
"wtchsalt","352","1","categorical","7","module 6: sodium or salt-related behavior","watching sodium or salt intake","0"
"wtkg3","2187","5","numeric","0","calculated variables","computed weight in kilograms","1"
